{
  "$schema": "./project.config.schema.json",
  "name": "meeting-ending-macro",
  "title": "Meeting Ending Macro",
  "description": "Alerts the room a configurable number of minutes before the current booking ends.",
  "author": "",
  "org": "wxsd-sales",
  "repo": "meeting-ending-macro",
  "macro": {
    "warningMinutes": 5,
    "alertDurationSeconds": 30,
    "alertTitle": "Meeting ending soon"
  }
}
